,number,context,question,A,B,C,D,E,answer,context-images
38,128,"


BONS DIAS!
14 de junho de 1889
Ó doce, ó longa, ó inexprimível melancolia dos jornais velhos! Conhece-se um homem diante de um deles. Pessoa que não sentir alguma coisa ao ler folhas de meio século, bem pode crer que não terá nunca uma das mais profundas sensações da vida, – igual ou quase igual à que dá a vista das ruínas de uma civilização. Não é a saudade piegas, mas a recomposição do extinto, a revivescência do passado.

ASSIS, M. Bons dias! (Crônicas 1888-1889). Campinas: Editora da Unicamp; São Paulo: Hucitec, 1990.



","

O jornal impresso é parte integrante do que hoje se compreende por tecnologias de informação e comunicação. Nesse texto, o jornal é reconhecido como


",objeto de devoção pessoal.,elemento de afirmação da cultura.,instrumento de reconstrução da memória.,ferramenta de investigação do ser humano.,veículo de produção de fatos da realidade.,C,
39,130,"


Lições de motim
DONA COTINHA – É claro! Só gosta de solidão quem nasceu pra ser solitário. Só o solitário gosta de solidão. Quem vive só e não gosta da solidão não é um solitário, é só um desacompanhado. (A reflexão escorrega lá pro fundo da alma.) Solidão é vocação, besta de quem pensa que é sina. Por isso, tem de ser valorizada. E não é qualquer um que pode ser solitário, não. Ah, mas não é mesmo! É preciso ter competência pra isso. (De súbito, pedagógica, volta-se para o homem.) É como poesia, sabe, moço? Tem de ser recitada em voz alta, que é pra gente sentir o gosto. (FAZ UMA PAUSA.) Você gosta de poesia? (O HOMEM TORNA A SE DEBATER. A VELHA INTERROMPE O DISCURSO E VOLTA A LHE DAR AS COSTAS, COMO SEMPRE, IMPASSÍVEL. O HOMEM, MAIS UMA VEZ, CANSADO, DESISTE.) Bem, como eu ia dizendo, pra viver bem com a solidão temos de ser proprietários dela e não inquilinos, me entende? Quem é inquilino da solidão não passa de um abandonado. É isso aí.

ZORZETTI, H. Lições de motim. Goiânia: Kelps, 2010 (adaptado).



","

Nesse trecho, o que caracteriza Lições de motim como texto teatral?


",O tom melancólico presente na cena.,As perguntas retóricas da personagem.,A interferência do narrador no desfecho da cena.,O uso de rubricas para construir a ação dramática.,As analogias sobre a solidão feitas pela personagem.,D,
40,126,"


Entrevista com Terezinha Guilhermina
Terezinha Guilhermina é uma das atletas mais premiadas da história paraolímpica do Brasil e um dos principais nomes do atletismo mundial. Está no Guinness Book de 2013/2014 como a “cega” mais rápida do mundo.
Observatório: Quais os desafios você teve que superar para se consagrar como atleta profissional?
Terezinha Guilhermina: Considero a ausência de recursos financeiros, nos três primeiros anos da minha carreira, como meu principal desafio. A falta de um atleta-guia, para me auxiliar nos treinamentos, me obrigava a treinar sozinha e, por não enxergar bem, acabava sofrendo alguns acidentes como trombadas e quedas.
Observatório: Como está a preparação para os Jogos Paraolímpicos de 2016?
Terezinha Guilhermina: Estou trabalhando intensamente, com vistas a chegar lá bem melhor do que estive em Londres. E, por isso, posso me dedicar a treinos diários, trabalhos preventivos de lesões e acompanhamento psicológico e nutricional da melhor qualidade.

Revista do Observatório Brasil de Igualdade de Gênero, n. 6, dez. 2014 (adaptado).



","

O texto permite relacionar uma prática corporal com uma visão ampliada de saúde. O fator que possibilita identificar essa perspectiva é o(a)


",aspecto nutricional.,condição financeira.,prevenção de lesões.,treinamento esportivo.,acompanhamento psicológico.,B,
41,134,"


Primeira lição
Os gêneros de poesia são: lírico, satírico, didático, épico, ligeiro.
O gênero lírico compreende o lirismo.
Lirismo é a tradução de um sentimento subjetivo, sincero
e pessoal.
É a linguagem do coração, do amor.
O lirismo é assim denominado porque em outros tempos os
versos sentimentais eram declamados ao som da lira.
O lirismo pode ser:
a) Elegíaco, quando trata de assuntos tristes, quase sempre a morte.
b) Bucólico, quando versa sobre assuntos campestres.
c) Erótico, quando versa sobre o amor.
O lirismo elegíaco compreende a elegia, a nênia, a endecha, o epitáfio e o epicédio.
Elegia é uma poesia que trata de assuntos tristes.
Nênia é uma poesia em homenagem a uma pessoa morta.
Era declamada junto à fogueira onde o cadáver era incinerado.
Endecha é uma poesia que revela as dores do coração.
Epitáfio é um pequeno verso gravado em pedras tumulares.
Epicédio é uma poesia onde o poeta relata a vida de uma pessoa morta.

CESAR. A. C. Poética. São Paulo. Companhia das Letras, 2013



","

No poema de Ana Cristina Cesar, a relação entre as definições apresentadas e o processo de construção do texto indica que o(a)


",caráter descritivo dos versos assinala uma concepção irônica de lirismo.,tom explicativo e contido constitui uma forma peculiar de expressão poética.,seleção e o recorte do tema revelam uma visão pessimista da criação artística.,enumeração de distintas manifestações líricas produz um efeito de impessoalidade.,referência a gêneros poéticos clássicos expressa a adesão do eu lírico às tradições literárias.,B,
42,132,"


L.J.C.
– 5 tiros?
– É.
– Brincando de pegador?
– É. O PM pensou que…
– Hoje?
– Cedinho.

COELHO, M. In: FREIRE, M. (Org.). Os cem menores contos brasileiros do século. São Paulo: Ateliê Editorial, 2004.



","

Os sinais de pontuação são elementos com importantes funções para a progressão temática. Nesse miniconto, as reticências foram utilizadas para indicar


",uma fala hesitante.,uma informação implícita.,uma situação incoerente.,a eliminação de uma ideia.,a interrupção de uma ação.,B,
43,123,"









Espetáculo Romeu e Julieta, Grupo Galpão.

GUTO MUNIZ. Disponível em: www.focoincena.com.br. Acesso em: 30 maio 2016.



","

A principal razão pela qual se infere que o espetáculo retratado na fotografia é uma manifestação do teatro de rua é o fato de


",dispensar o edifício teatral para a sua realização.,utilizar figurinos com adereços cômicos.,empregar elementos circenses na atuação.,excluir o uso de cenário na ambientação.,negar o uso de iluminação artificial.,A,enem-data/enem-2016/123-images/context_img_0.png
44,131,"


A obra de Túlio Piva poderia ser objeto de estudo nos bancos escolares, ao lado de Noel, Ataulfo e Lupicínio. Se o criador optou por permanecer em sua querência – Santiago, e depois Porto Alegre, a obra alçou voos mais altos, com passagens na Rússia, Estados Unidos e Venezuela. Tem que ter mulata, seu samba maior, é coisa de craque. Um retrato feito de ritmo e poesia, uma ode ao gênero que amou desde sempre. E o paradoxo: misto de gaúcho e italiano, nascido na fronteira com a Argentina, falando de samba, morro e mulata, com categoria. E que categoria! Uma batida de violão que fez história. O tango transmudado em samba.

RAMIREZ, H.; PIVA, R. (Org.). Túlio Piva: pra ser samba brasileiro.
Porto Alegre: Programa Petrobras Cultural, 2005 (adaptado).



","

O texto é um trecho da crítica musical sobre a obra de Túlio Piva. Para enfatizar a qualidade do artista, usou-se como recurso argumentativo o(a)


",contraste entre o local de nascimento e a escolha pelo gênero samba.,exemplo de temáticas gaúchas abordadas nas letras de sambas.,alusão a gêneros musicais brasileiros e argentinos.,comparação entre sambistas de diferentes regiões.,aproximação entre a cultura brasileira e a argentina.,A,
45,135,"


Você pode não acreditar
Você pode não acreditar: mas houve um tempo em que os leiteiros deixavam as garrafinhas de leite do lado de fora das casas, seja ao pé da porta, seja na janela.
A gente ia de uniforme azul e branco para o grupo, de manhãzinha, passava pelas casas e não ocorria que alguém pudesse roubar aquilo.
Você pode não acreditar: mas houve um tempo em que os padeiros deixavam o pão na soleira da porta ou na janela que dava para a rua. A gente passava e via aquilo como uma coisa normal.
Você pode não acreditar: mas houve um tempo em que você saía à noite para namorar e voltava andando pelas ruas da cidade, caminhando displicentemente, sentindo cheiro de jasmim e de alecrim, sem olhar para trás, sem temer as sombras.
Você pode não acreditar: houve um tempo em que as pessoas se visitavam airosamente. Chegavam no meio da tarde ou à noite, Contavam casos, tomavam café, falavam da saúde, tricotavam sobre a vida alheia e voltavam de bonde às suas casas.
Você pode não acreditar: mas houve um tempo em que o namorado primeiro ficava andando com a moça numa rua perto da casa dela, depois passava a namorar no portão, depois tinha ingresso na sala da família. Era sinal de que já estava praticamente noivo e seguro.
Houve um tempo em que havia tempo.
Houve um tempo.

SANT’ANNA, A. R. Estado de Minas. 5 maio 2013 (fragmento).



","

Nessa crônica, a repetição do trecho “Você pode não acreditar: mas houve um tempo em que…” configura-se como uma estratégia argumentativa que visa


",surpreender o leitor com a descrição do que as pessoas faziam durante o seu tempo livre antigamente.,sensibilizar o leitor sobre o modo como as pessoas se relacionavam entre si num tempo mais aprazível.,advertir o leitor mais jovem sobre o mau uso que se faz do tempo nos dias atuais.,incentivar o leitora organizar melhor o seu tempo sem deixar de ser nostálgico.,convencer o leitor sobre a veracidade de fatos relativos à vida no passado.,B,
46,129,"


TEXTO I













BACON, F. Três estudos para um autorretrato. Óleo sobre tela, 37,5 x 31,8 cm (cada), 1974.
Disponível em: www.metmuseum.org. Acesso em: 30 maio 2016.





TEXTO II
Tenho um rosto lacerado por rugas secas e profundas, sulcos na pele. Não é um rosto desfeito, como acontece com pessoas de traços delicados, o contorno é o mesmo mas a matéria foi destruída. Tenho um rosto destruído.

DURAS, M. O amante. Rio de Janeiro: Nova Fronteira, 1985.



","

Na imagem e no texto do romance de Marguerite Duras, os dois autorretratos apontam para o modo de representação da subjetividade moderna. Na pintura e na literatura modernas, o rosto humano deforma-se, destrói-se ou fragmenta-se em razão


","da adesão à estética do grotesco, herdada do romantismo europeu, que trouxe novas possibilidades de representação.",das catástrofes que assolaram o século XX e da descoberta de uma realidade psíquica pela psicanálise.,da opção em demonstrarem oposição aos limites estéticos da revolução permanente trazida pela arte moderna.,"do posicionamento do artista do século XX contra a negação do passado, que se torna prática dominante na sociedade burguesa.",da intenção de garantir uma forma de criar obras de arte independentes da matéria presente em sua história pessoal.,B,enem-data/enem-2016/129-images/context_img_0.png
47,133,"


O nome do inseto pirilampo (vaga-lume) tem uma interessante certidão de nascimento. De repente, no fim do século XVII, os poetas de Lisboa repararam que não podiam cantar o inseto luminoso, apesar de ele ser um manancial de metáforas, pois possuía um nome “indecoroso” que não podia ser “usado em papéis sérios”: caga-lume. Foi então que o dicionarista Raphael Bluteau inventou a nova palavra, pirilampo, a partir do grego pyr, significando “fogo”, e lampas, “candeia”.

FERREIRA, M. B. Caminhos do português: exposição comemorativa do Ano Europeu das Linguas. Portugal: Biblioteca Nacional, 2001 (adaptado).



","

O texto descreve a mudança ocorrida na nomeação do inseto, por questões de tabu linguístico. Esse tabu diz respeito à


",recuperação histórica do significado.,ampliação do sentido de uma palavra.,produção imprópria de poetas portugueses.,denominação científica com base em termos gregos.,restrição ao uso de um vocábulo pouco aceito socialmente.,E,
48,127,"


É possível considerar as modalidades esportivas coletivas dentro de uma mesma lógica, pois possuem uma estrutura comum: seis princípios operacionais divididos em dois grupos, o ataque e a defesa. Os três princípios operacionais de ataque são: conservação individual e coletiva da bola, progressão da equipe com a posse da bola em direção ao alvo adversário e finalização da jogada, visando a obtenção de ponto. Os três princípios operacionais da defesa são: recuperação da bola, impedimento do avanço da equipe contrária com a posse da bola e proteção do alvo para impedir a finalização da equipe adversária.

DAOLIO, J. Jogos esportivos coletivos: dos princípios operacionais aos gestos técnicos –
modelo pendular a partir das ideias de Claude Bayer. Revista Brasileira de Ciência e Movimento,
out. 2002 (adaptado).



","

Considerando os princípios expostos no texto, o drible no handebol caracteriza o princípio de


",recuperação da bola.,progressão da equipe.,finalização da jogada.,proteção do próprio alvo.,impedimento do avanço adversário.,B,
49,118,"










Disponível em: www.paradapelavida.com.br. Acesso em: 15 nov. 2014.



","

Nesse texto, a combinação de elementos verbais e não verbais configura-se como estratégia argumentativa para


",manifestar a preocupação do governo com a segurança dos pedestres.,associar a utilização do celular às ocorrências de atropelamento de crianças.,orientar pedestres e motoristas quanto à utilização responsável do telefone móvel.,influenciar o comportamento de motoristas em relação ao uso de celular no trânsito.,alertar a população para os riscos da falta de atenção no trânsito das grandes cidades.,D,enem-data/enem-2016/118-images/context_img_0.png
