,number,context,question,A,B,C,D,E,answer,context-images
0,92,"


Preámbulo a las instrucciones para dar cuerda al reloj
Piensa en esto: cuando te regalan un reloj te regalan un pequeño infierno florido, una cadena de rosas, un calabozo de aire. No te dan solamente el reloj, que los cumplas muy felices y esperamos que te dure porque es de buena marca, suizo con áncora de rubíes; no te regalan solamente ese menudo picapedrero que te atarás a la muñeca y pasearás contigo. Te regalan -no lo saben, lo terrible es que no lo saben-, te regalan un nuevo pedazo frágil y precario de ti mismo, algo que es tuyo pero no es tu cuerpo, que hay que atar a tu cuerpo con su correa como un bracito desesperado colgándose de tu muñeca. Te regalan la necesidad de darle cuerda todos los días, la obligación de darle cuerda para que siga siendo un reloj; te regalan la obsesión de atender a la hora exacta en las vitrinas de las joyerías, en el anuncio por la radio, en el servicio telefónico. Te regalan el miedo de perderlo, de que te lo roben, de que se te caiga al suelo y se rompa. Te regalan su marca, y la seguridad de que es una marca mejor que las otras, te regalan la tendencia de comparar tu reloj con los demás relojes. No te regalan un reloj, tú eres el regalado, a ti te ofrecen para el cumpleaños del reloj.

CORTÁZAR, J. Historias de cronopios y de famas. Buenos Aires: Sudamericana, 1963 (fragmento).



","

Nesse texto, Júlio Cortázar transforma pequenas ações cotidianas em criação literária,


",denunciando a má qualidade dos relógios modernos em relação aos antigos.,apresentando possibilidades de sermos presenteados com um relógio.,convidando o leitor a refletir sobre a coisificação do ser humano.,desafiando o leitor a pensar sobre a efemeridade do tempo.,criticando o leitor por ignorar os malefícios do relógio.,C,
1,100,"


O hoax, como é chamado qualquer boato ou farsa na internet, pode espalhar vírus entre os seus contatos. Falsos sorteios de celulares ou frases que Clarice Lispector nunca disse são exemplos de hoax. Trata-se de boatos recebidos por e-mail ou compartilhados em redes sociais. Em geral, são mensagens dramáticas ou alarmantes que acompanham imagens chocantes, falam de crianças doentes ou avisam sobre falsos vírus. O objetivo de quem cria esse tipo de mensagem pode ser apenas se divertir com a brincadeira (de mau gosto), prejudicar a imagem de uma empresa ou espalhar uma ideologia política.
Se o hoax for do tipo phishing (derivado de fishing, pescaria, em inglês) o problema pode ser mais grave: o usuário que clicar pode ter seus dados pessoais ou bancários roubados por golpistas. Por isso é tão importante ficar atento.

VIMERCATE, N.Disponível em: www.techtudo.com.br. Acesso em 1 maio 2013 (adaptado).



","

Ao discorrer sobre os hoaxes, o texto sugere ao leitor, como estratégia para evitar essa ameaça,


",recusar convites de jogos e brincadeiras feitos pela internet.,analisar a linguagem utilizada nas mensagens recebidas.,classificar os contatos presentes em suas redes sociais.,utilizar programas que identifiquem falsos vírus.,desprezar mensagens que causem comoção.,B,
2,93,"


Frankentissue: printable cell technology
In November, researchers from the University of Wollongong in Australia announced a new bio-ink that is a step toward really printing living human tissue on an inkjet printer. It is like printing tissue dot-by-dot. A drop of bio-ink contains 10,000 to 30,000 cells. The focus of much of this research is the eventual production of tailored tissues suitable for surgery, like living Band-Aids, which could be printed on the inkjet.
However, it is still nearly impossible to effectively replicate nature’s ingenious patterns on a home office accessory. Consider that the liver is a series of globules, the kidney a set of pyramids. Those kinds of structures demand 3D printers that can build them up, layer by layer. At the moment, skin and other flat tissues are most promising for the inkjet.

Disponível em: http://discovermagazine.com. Acesso em 2 dez 2012



","

O texto relata perspectivas no campo da tecnologia para cirurgias em geral, e a mais promissora para este momento enfoca o(a)


",uso de um produto natural com milhares de células para reparar tecidos humanos.,criação de uma impressora especial para traçar mapas cirúrgicos detalhados.,desenvolvimento de uma tinta para produzir pele e tecidos humanos finos.,reprodução de células em 3D para ajudar nas cirurgias de recuperação dos rins.,extração de glóbulos do fígado para serem reproduzidos em laboratório.,C,
3,91,"


La Sala II de la Cámara de Casación Penal ordenó que Marcela y Felipe Noble Herrera, los hijos adoptivos de la duena de Clarín, se sometan “a la extracción directa, con o sin consentimiento, de mínimas muestras de sangre, saliva, piei, cabello u otras muestras biológicas” que les pertenezcan de “manera indubitable” para poder determinar si son hijos de desaparecidos. El tribunal, así, hizo lugar a un reclamo de las Abuelas de Plaza de Mayo y movió un casillero una causa judicial que ya lleva diez anos de indefinición. Sin embargo, simultáneamente, fijó un limite y sólo habilito la comparación de los perfiles genéticos de los jóvenes con el ADN de las familias de personas “detenidas o desaparecidas con certeza” hasta el 13 de mayo de 1976, en el caso de Marcela, y hasta el 7 de julio del mismo ano en el de Felipe. La obtención del material genético no será inmediata, ya que algunas de las partes apelarán y el tema inevitablemente desembocará a la Corte Suprema, que tendrá la palabra final sobre la discusión de fondo.
“Es una de cal y otra de arena, es querer quedar bien con Dios y con el diablo”, resumió la presidenta de Abuelas, Estela Carlotto, su primera impresión de la resolución que firmaron Guillermo Yacobucci, Luis García y Raúl Madueño. Aun así la evaluó como “un paso importante” porque determina que “sí o sí la extracción de sangre o de elementos que
contengan ADN debe proceder”. “Lo que nos cayó mal”, acotó, es “la limitación” temporal que permitirá que la comparación se haga sólo con un grupo de familias. “Seguimos con la historia de que acá hay de primera y de segunda. Por qué todos los demás casos siempre se han comparado con el Banco (de Datos Genéticos) completo y en éste no?”, se preguntó.

HAUSER, I. Disponível em: www.pagina12.com.ar. Acesso em: 30 maio 2016.



","

Nessa notícia, publicada no jornal argentino Página 12, citam-se comentários de Estela Carlotto, presidente da associação Abuelas de Plaza de Mayo, com relação a uma decisão do tribunal argentino. No contexto da fala, a expressão “una de cal y otra de arena” é utilizada para


",referir-se ao fato de a decisão judicial não implicar a sua imediata aplicação.,destacar a inevitável execução da sentença.,ironizar a parcialidade da Justiça nessa ação,criticar a coleta compulsória do material genético.,enfatizar a determinação judicial como algo consolidado.,C,
4,91,"


Italian university switches to English
By Sean Coughlan, BBC News education correspondent 16 May 2012 Last updated at 09:49 GMT
Milan is crowded with Italian icons, which makes it even more of a cultural earthquake that one Of Italy’s leading universities – the Politecnico di Milano – Is going to switch to the English language. The university has announced that from 2014 most of its degree Courses – including all its graduate courses – will be taught and assessed entirely in English rather than Italian.
The waters of globalisation are rising around higher education – and the university believes that if it remains Italian-speaking it risks isolation and will be unable to compete as an international institution. “We strongly believe our classes should be international classes – and the only way to have international classes is to use the English language”, says the university’s rector, Giovanni Azzone.

COUGHLAN, S. Disponível em: www.bbc.co.uk. Acesso em 31 jul. 2012.



","

As línguas têm um papel importante na comunicação entre pessoas de diferentes culturas. Diante do movimento de internacionalização no ensino superior, a universidade Politecnico di Milano decidiu


",elaborar exames em língua inglesa para o ingresso na universidade.,ampliar a oferta de vagas na graduação para alunos estrangeiros.,investir na divulgação da universidade no mercado internacional.,substituir a língua nacional para se inserir no contexto da globalização.,estabelecer metas para melhorar a qualidade do ensino de italiano.,D,
5,92,"


Ebony and ivory
Ebony and ivory live together in perfect harmony
Side by side on my piano keyboard, oh Lord, why don’t we?
We all know that people are the same wherever we go
There is good and bad in ev’ryone,
We learn to live, we learn to give
Each other what we need to survive together alive
 

McCARTNEY P. Disponível em: www.paulmccartney.com. Acesso em: 30 maio 2016.



","

Em diferentes épocas e lugares, compositores têm utilizado seu espaço de produção musical para expressar e problematizar perspectivas de mundo. Paul McCartney, na letra dessa canção, defende


",o aprendizado compartilhado.,a necessidade de donativos.,as manifestações culturais.,o bem em relação ao mal.,o respeito étnico.,E,
6,98,"


Até que ponto replicar conteúdo é crime? “A internet e a pirataria são inseparáveis”, diz o diretor do instituto de pesquisas americano Social Science Research Council. “Há uma infraestrutura pequena para controlar quem é o dono dos arquivos que circulam na rede. Isso acabou com o controle sobre a propriedade e tem sido descrito como pirataria, mas é inerente à tecnologia”, afirma o diretor. O ato de distribuir cópias de um trabalho sem a autorização dos seus produtores pode, sim, ser considerado crime, mas nem sempre essa distribuição gratuita lesa os donos dos direitos autorais. Pelo contrário. Veja o caso do livro O alquimista, do escritor Paulo Coelho. Após publicar, para download gratuito, uma versão traduzida da obra em seu blog, Coelho viu as vendas do livro em papel explodirem.

BARRETO, J.; MORAES, M. A internet existe sem pirataria?
Veja, n. 2 308, 13 fev. 2013 (adaptado).



","

De acordo com o texto, o impacto causado pela internet propicia a


",banalização da pirataria na rede.,adoção de medidas favoráveis aos editores.,implementação de leis contra crimes eletrônicos.,reavaliação do conceito de propriedade intelectual.,ampliação do acesso a obras de autores reconhecidos.,D,
7,95,"


BOGOF is used as a noun as in ‘There are some great bogofs on at the supermarket’ or an adjective, usually with a word such as ‘offer’ or ‘deal’ – ‘there are some great bogof offers in store’.
When you combine the first letters of the words in a phrase or the name of an organisation, you have an acronym. Acronyms are spoken as a word so NATO (North Atlantic Treaty Organisation) is not pronounced N-A-T-O. We say NATO. Bogof, when said out loud, is quite comical for a native speaker, as it sounds like an insult, ‘Bog off!’ meaning go away, leave me alone, slightly childish and a little old-fashioned.
BOGOF is the best-known of the supermarket marketing strategies. The concept was first imported from the USA during the 1970s recession, when food prices were very high. It came back into fashion in the late 1990s, led by big supermarket chains trying to gain a competitive advantage over each other. Consumers were attracted by the idea that they could get something for nothing. Who could possibly say ‘no’?

Disponível em: www.bbc.co.uk. Acesso em 2 ago. 2012 (adaptado).



","

Considerando-se as informações do texto, a expressão “bogof” é usada para


",anunciar mercadorias em promoção.,pedir para uma pessoa se retirar.,comprar produtos fora de moda.,indicar recessão na economia.,chamar alguém em voz alta.,A,
8,95,"


Agua
al soñar que un cántaro
en la cabeza acarreas,
será éxito y triunfo lo que tú veas.
Bañarse en un río
donde el agua escalda,
es augurio de enemigos
y de cuchillo en la espalda.
Bañarse en un río de agua puerca,
es perder a alguien cerca.

ORTIZ, A.; FLORES FARFÁN, J. A. Sueños mexicanos. México: Artes de México, 2012



","

O poema retoma elementos da cultura popular mexicana que refletem um dos aspectos que a constitui, caracterizado pela


",percepção dos perigos de banhar-se em rios de águas poluídas.,crença na relevância dos sonhos como premonições ou conselhos.,necessidade de resgate da tradição de carregar água em cântaros.,exaltação da importância da preservação da água.,cautela no trato com inimigos e pessoas traiçoeiras.,B,
9,93,"


Inestabilidad estable
Los que llevan toda la vida esforzándose por conseguir un pensamiento estable, con suficiente solidez como para evitar que la incertidumbre se apodere de sus habilidades, todas esas lecciones sobre cómo asegurarse el porvenir, aquellos que nos aconsejaban que nos dejáramos de bagatelas poéticas y encontráramos un trabajo fixo y etcétera, abuelos, padres, maestros, suegros, bancos y seguradoras, nos estaban dando gato por liebre.
Y el mundo, este mundo que nos han creado, que al tocarlo en la pantalla creemos estar transformando a medida de nuestro deseo, nos está modelando según coeficiente de rentabilidad, nos está licuando para integrarnos a su metabolismo reflejo.

FÉRNANDEZ ROJANO, G. Disponível em: http://diariojaen.es Acesso em: 23 maio 2012.



","

O título do texto antecipa a opinião do autor pelo uso de dois termos contraditórios que expressam o sentido de


","competitividade e busca do lucro, que caracterizam a sociedade contemporânea.","busca de estabilidade financeira e emocional, que marca o mundo atual.",negação dos valores defendidos pelas gerações anteriores em relação ao trabalho.,necessidade de realização pessoal e profissional no sistema vigente.,permanência da inconstância em uma sociedade marcada por contínuas mudanças.,E,
10,99,"


Em casa, Hideo ainda podia seguir fiel ao imperador japonês e às tradições que trouxera no navio que aportara em Santos. […] Por isso Hideo exigia que, aos domingos, todos estivessem juntos durante o almoço. Ele se sentava à cabeceira da mesa; à direita ficava Hanashiro, que era o primeiro filho, e Hitoshi, o segundo, e à esquerda, Haruo, depois Hiroshi, que era o mais novo. […] A esposa, que também era mãe, e as filhas, que também eram irmãs, aguardavam de pé ao redor da mesa […]. Haruo reclamava, não se cansava de reclamar: que se sentassem também as mulheres à mesa, que era um absurdo aquele costume. Quando se casasse, se sentariam à mesa a esposa e o marido, um em frente ao outro, porque não era o homem melhor que a mulher para ser o primeiro […]. Elas seguiam de pé, a mãe um pouco cansada dos protestos do filho, pois o momento do almoço era sagrado, não era hora de levantar bandeiras inúteis […].

NAKASATO, O. Nihonjin. São Paulo: Benvirá, 2011 (fragmento).



","

Referindo-se a práticas culturais de origem nipônica, o narrador registra as reações que elas
provocam na família e mostra um contexto em que


",a obediência ao imperador leva ao prestígio pessoal.,as novas gerações abandonam seus antigos hábitos.,a refeição é o que determina a agregação familiar,os conflitos de gênero tendem a ser neutralizados.,o lugar à mesa metaforiza uma estrutura de poder,E,
11,96,"


Ler não é decifrar, como num jogo de adivinhações, o sentido de um texto. É, a partir do texto, ser capaz de atribuir-lhe significado, conseguir relacioná-lo a todos os outros textos significativos para cada um, reconhecer  nele o tipo de  leitura que seu autor pretendia e, dono da própria vontade, entregar-se a essa leitura, ou rebelar-se contra ela, propondo uma outra não prevista.

(LAJOLO, M.  Do mundo  da leitura para a  leitura do  mundo. São  Paulo:  Ática, 1993)



","

Nesse  texto, a  autora apresenta reflexões sobre o  processo de produção de  sentidos, valendo-se da metalinguagem.  Essa função da linguagem torna-se evidente pelo  fato de  o  texto


",ressaltar a importância da  intertextualidade.,propor leituras diferentes das previsíveis.,apresentar o ponto de vista da autora.,discorrer sobre o ato da leitura.,focar a participação do leitor.,D,
12,94,"










ACCIÓN POÉTICA LIMA. Disponível em: https://twitter.com. Acesso em: 30 maio 2016.



","

Nesse grafite, realizado por um grupo que faz intervenções artísticas na cidade de Lima, há um jogo de palavras como verbo “poner”. Na primeira ocorrência, o verbo equivale a “vestir uma roupa”, já na segunda, indica


",início de ação.,mudança de estado.,conclusão de ideia.,simultaneidade de fatos.,continuidade de processo.,B,enem-data/enem-2016/94-images/context_img_0.png
13,102,"


PINHÃO Sai ao mesmo tempo que BENONA entra.
BENONA: Eurico, Eudoro Vicente está lá fora e quer falar com você.
EURICÃO: Benona, minha irmã, eu sei que ele está lá fora, mas não quero falar com ele.
BENONA: Mas Eurico, nós lhe devemos certas atenções.
EURICÃO: Você, que foi noiva dele. Eu, não!
BENONA: Isso são coisas passadas.
EURICÃO: Passadas para você, mas o prejuízo foi meu. Esperava que Eudoro, com todo aquele dinheiro, se tornasse meu cunhado. Era uma boca a menos e um patrimônio a mais. E o peste me traiu. Agora, parece que ouviu dizer que eu tenho um tesouro. E vem louco atrás dele, sedento, atacado de verdadeira hidrofobia. Vive farejando ouro, como um cachorro da molest’a, como um urubu, atrás do sangue dos outros. Mas ele está enganado. Santo Antônio há de proteger minha pobreza e minha devoção.

SUASSUNA, A. O santo e a porca, Rio de Janeiro: José Olympio, 2013 (fragmento)



","

Nesse texto teatral, o emprego das expressões “o peste” e “cachorro da molest’a” contribui para


",marcar a classe social das personagens.,caracterizar usos linguísticos de uma região.,enfatizar a relação familiar entre as personagens.,sinalizar a influência do gênero nas escolhas vocabulares.,demonstrar o tom autoritário da fala de uma das personagens.,B,
14,94,"










Disponível em: www.ct.gov. Acesso em: 30 jul. 2012 (adaptado).



","

Orientações à população são encontradas também em sites oficiais. Ao clicar no endereço eletrônico mencionado no cartaz disponível na internet, o leitor tem acesso aos (às)


",ações do governo local referentes a calamidades.,relatos de sobreviventes em tragédias marcantes.,tipos de desastres naturais possíveis de acontecer.,informações sobre acidentes ocorridos em Connecticut.,medidas de emergência a serem tomadas em catástrofes.,E,enem-data/enem-2016/94-images/context_img_0.png
15,104,"


Antiode
Poesia, não será esse
o sentido em que
ainda te escrevo:
flor! (Te escrevo:
flor! Não uma
flor, nem aquela
flor-Virtude – em disfarçados urinóis).
Flor é a palavra
flor; verso inscrito
no verso, como as
manhãs no tempo.
Flor é o salto
da ave para o voo:
o saltofora do sono
quando seu tecido
se rompe; é uma explosão
posta a funcionar,
como uma máquina,
uma jarra de flores.

MELO NETO, J. C. Psicologia da composição Rio de Janeiro Nova Fronteira, 1997 (fragmento)



","

A poesia é marcada pela recriação do objeto por meio da linguagem, sem necessariamente explicá-lo. Nesse fragmento de João Cabral de Melo Neto, poeta da geração de 1945, o sujeito lírico propõe a recriação poética de


","uma palavra, a partir de imagens com as quais ela pode ser comparada, a fim de assumir novos significados.","um urinol, em referência às artes visuais ligadas às vanguardas do início do século XX.","uma ave, que compõe, com seus movimentos, uma imagem historicamente ligada à palavra poética.","uma máquina, levando em consideração a relevância do discurso técnico-científico pós-Revolução Industrial.","um tecido, visto que sua composição depende de elementos intrínsecos ao eu lírico.",A,
16,108,"


Sem acessórios nem som
Escrever só para me livrar
de escrever.
Escrever sem ver, com riscos
sentindo falta dos acompanhamentos
com as mesmas lesmas
e figuras sem força de expressão.
Mas tudo desafina:
o pensamento pesa
tanto quanto o corpo
enquanto corto os conectivos
corto as palavras rentes
com tesoura de jardim
cega e bruta
com facão de mato.
Mas a marca deste corte
tem que ficar
nas palavras que sobraram.
Qualquer coisa do que desapareceu
continuou nas margens, nos talos
no atalho aberto a talhe de foice
no caminho de rato

FREITAS FILHO, A. Máquina de escrever: poesia reunida e revista. Rio de Janeiro: Nova Fronteira, 2003.



","

Nesse texto, a reflexão sobre o processo criativo aponta para uma concepção de atividade
poética que põe em evidência o(a)


","angustiante necessidade de produção, presente em “Escrever só para me livrar/ de escrever”.","imprevisível percurso da composição, presente em “no atalho aberto a talhe de foice/ no caminho de rato”.","agressivo trabalho de supressão, presente em “corto as palavras rentes/ com tesoura de jardim/ cega e bruta”.","inevitável frustração diante do poema, presente em “Mas tudo desafina:/ o pensamento pesa/ tanto quanto o corpo”.","conflituosa relação com a inspiração, presente em “sentindo falta dos acompanhamentos/ e figuras sem força de expressão”.",C,
17,105,"


Qual é a segurança do sangue?
Para que o sangue esteja disponível para aqueles que necessitam, os indivíduos saudáveis devem criar o hábito de doar sangue e encorajar amigos e familiares saudáveis a praticarem o mesmo ato.
A prática de selecionar criteriosamente os doadores, bem como as rígidas normas aplicadas para testar, transportar, estocar e transfundir o sangue doado fizeram dele um produto muito mais seguro do que já foi anteriormente.
Apenas pessoas saudáveis e que não sejam de risco para adquirir doenças infecciosas transmissíveis pelo sangue, como hepatites B e C, HIV, sífilis e Chagas, podem doar sangue.
Se você acha que sua saúde ou comportamento pode colocar em risco a vida de quem for receber seu sangue, ou tem a real intenção de apenas realizar o teste para o vírus HIV, NÃO DOE SANGUE.
Cumpre destacar que apesar de o sangue doado ser testado para as doenças transmissíveis conhecidas no momento, existe um período chamado de janela imunológica em que um doador contaminado por um determinado vírus pode transmitir a doença através do seu sangue.
DA SUA HONESTIDADE DEPENDE A VIDA DE QUEM VAI RECEBER SEU SANGUE.

Disponível em: www.prosangue.sp.gov.br. Acesso em: 24 abr. 2015 (adaptado).



","

Nessa campanha, as informações apresentadas têm como objetivo principal


",conscientizar o doador de sua corresponsabilidade pela qualidade do sangue.,garantir a segurança de pessoas de grupos de risco durante a doação de sangue.,esclarecer o público sobre a segurança do processo de captação do sangue.,alertar os doadores sobre as dificuldades enfrentadas na coleta de sangue.,ampliar o número de doadores para manter o banco de sangue.,A,
18,106,"


TEXTO I
Entrevistadora – eu vou conversar aqui com a professora A. D. … o português então não é uma língua difícil?
Professora – olha se você parte do princípio… que a língua portuguesa não é só regras gramaticais… não se você se apaixona pela língua que você… já domina que você já fala ao chegar na escola se o teu professor cativa você a ler obras da literatura… obras da/ dos meios de comunicação… se você tem acesso a revistas… é… a livros didáticos… a… livros de literatura o mais formal o e/ o difícil é porque a escola transforma como eu já disse as aulas de língua portuguesa em análises gramaticais.
TEXTO II
Entrevistadora – Vou conversar com a professora A. D. O português é uma língua difícil?
Professora – Não, se você parte do princípio que a língua portuguesa não é só regras gramaticais. Ao chegar à escola, o aluno já domina e fala a língua. Se o professor motivá-lo a ler obras literárias, e se tem acesso a revistas, a livros didáticos, você se apaixona pela língua. O que torna difícil é que a escola transforma as aulas de língua portuguesa em análises gramaticais.

MARCUSCHI, L. A. Da fala para a escrita: atividades de retextualização.
São Paulo: Cortez, 2001 (adaptado).



","

O Texto I é a transcrição de uma entrevista concedida por uma professora de português a um programa de rádio. O Texto II é a adaptação dessa entrevista para a modalidade escrita. Em comum, esses textos


",apresentam ocorrências de hesitações e reformulações.,são modelos de emprego de regras gramaticais.,são exemplos de uso não planejado da língua.,apresentam marcas da linguagem literária.,são amostras do português culto urbano.,E,
